{"acquired_at":"2026-08-15T19:18:47Z","cosign_bundle":{"bytes":3896,"path":"p3-submitted.bundle.json","sha256":"518b516f8800d7c383d0183ead1f7720c8696dff1fb23a4d7a96afb435b40624"},"cosign_public_key":{"bytes":178,"path":"disposable-cosign.pub","sha256":"d3fcbb09ad74beef7952fcfeb972fe7bd41f718daf7827c28e8a13253f8028d8"},"github_intermediate":{"bytes":802,"path":"github-tsa-intermediate.pem","sha256":"ebfcb01e412d295adcfd67fe3e7546a1f01b033074da03abdde0de9e99c96eac"},"github_leaf":{"bytes":790,"path":"github-tsa-leaf.pem","sha256":"06940aa850c0912e7cf8d893b6bf509c719060f94eaa0a8b5deb5d7194e4bc77"},"github_root":{"bytes":741,"path":"github-tsa-root.pem","sha256":"6d6734c76d4280033315c30f63d20b7a8d5d4dd6d77c7446b08c93443beec26e"},"github_timestamp_token":{"bytes":1269,"path":"github-tsa-signature.tsr","sha256":"aae98e77610f089bff0bf94a9539be32c666616dffbc4070116dc79a78f4a706"},"profile_id":"p3-sigstore-rekor-v1-sigstore-tsa-github-rfc3161-v1","raw_signature":{"bytes":71,"path":"signature.raw","sha256":"9d3c0fc9866481f3f9618157b08c333de50bc43b65a59301eecbceccb7b0a9da"},"schema_version":"1.0","sigstore_trusted_root":{"bytes":5747,"path":"trusted-root.json","sha256":"844a1c6de3986c9f02070266b25e0d1a2fa99ceccc89f6b9ad90aae47b62a16e"},"submitted_envelope_sha256":"40ba60b75f180b8e78eb0c913e099531e1a52cf9c640ca8cab8f579782d6a687","tool_inventory":[{"bytes":198819314,"name":"cosign","sha256":"9fe59be0eca1271873ce019061335eb1ac419b7059202e797828467ddabe33be","version":"v3.1.3"},{"bytes":5747,"name":"sigstore-trusted-root","sha256":"844a1c6de3986c9f02070266b25e0d1a2fa99ceccc89f6b9ad90aae47b62a16e","version":"0.1"},{"bytes":22052352,"name":"timestamp-cli","sha256":"ef4bbf7715445f0c26a0fcdcd89162afab7d8dea64e5a8091ea3a1f804f22bd2","version":"v2.1.3"},{"bytes":1005028,"name":"openssl","sha256":"063e62dcc027fc5dbb1343de631f02a9291f8b1df0b4e37012e49a03d525aad4","version":"3.5.6"},{"bytes":12411,"name":"openssl-config","sha256":"e4c87d84d4650c39a0163544a4107842b2ca42487cb61ba570b03b011275d6c3","version":"3.5.6"}],"verification_policy_id":"p3-sigstore-rekor-v1-sigstore-tsa-github-rfc3161-v1"}
